{
  "$schema": "https://json-schema.org/draft/2020-12/schema",
  "$id": "https://wattsteer.com/schema/scenario.schema.json",
  "title": "Scenario",
  "description": "The body of `POST /v1/optimize`, and the base64url of the same canonical bytes on `GET /v1/optimize?s=`. **Not persisted**: the product is public, read-only and has no accounts, so the URL is the storage and there is no identity to invent. `v` is mandatory and rejected if unknown - a schema change bumps it and an old link then fails loudly rather than parsing into a subtly different scenario, which is the difference between a shareable URL and a time bomb.",
  "type": "object",
  "properties": {
    "v": { "const": 1 },
    "subsystem": { "$ref": "common.schema.json#/$defs/subsystem" },
    "target_date": { "$ref": "common.schema.json#/$defs/civil_date" },
    "forecast_origin": {
      "description": "Optional; the latest published origin if omitted. A bare instant, not the full `ForecastOrigin` object: what pins a scenario is which run it was optimised against.",
      "$ref": "common.schema.json#/$defs/utc_instant"
    },
    "assets": {
      "type": "array",
      "minItems": 1,
      "maxItems": 20,
      "items": { "$ref": "flexibility-asset.schema.json" }
    },
    "economic_assumptions": {
      "type": "object",
      "properties": {
        "brl_per_mwh": {
          "type": "number",
          "exclusiveMinimum": 0,
          "maximum": 10000,
          "description": "`ECONOMIC_ASSUMPTION_OUT_OF_RANGE`. Carried because R$ appears only as a labelled scenario with its assumption visible."
        }
      },
      "required": ["brl_per_mwh"],
      "additionalProperties": false
    }
  },
  "required": ["v", "subsystem", "target_date", "assets"],
  "additionalProperties": false
}
